{
  "contract": 1,
  "validityStarted": {
    "severity": "fail"
  },
  "validityNotEnded": {
    "severity": "warn"
  },
  "expiresWithin": {
    "value": "72h",
    "severity": "warn"
  },
  "maxLifetimeUsed": {
    "value": 0.66
  },
  "expectEku": {
    "value": [
      "serverAuth",
      "1.3.6.1.5.5.7.3.2"
    ]
  },
  "ekuAllows": {
    "value": [
      "serverAuth"
    ]
  },
  "rejectEku": {
    "value": [
      "codeSigning"
    ],
    "severity": "warn"
  },
  "expectSan": {
    "value": [
      "*.example.com",
      "2001:db8::1"
    ]
  },
  "expectFingerprint": {
    "value": "872a229969048f8dffb599a463b6438a35aa16c6eba1922db552e8560bccd508"
  },
  "expectKind": {
    "value": "end-entity"
  },
  "matchesPrivateKey": {
    "severity": "fail"
  }
}
